{"bundle_version":"DIARY_ONE_APP_LIBRARY_BUNDLE_V04","research_only":true,"session":{"session_id":"42cd74ac-979f-4b38-9643-8f4b5a6872db","exported_at":"2026-09-02T09:00:00Z","timezone":"TEST_DAY_NO_TIMEZONE"},"device":{"device_id":"web-test","hardware_revision":"PHONE_LIBRARY_TEST","firmware_version":"NOT_APPLICABLE","sdk_version":"WEB_EVIDENCE_V03"},"normalization":{"width":768,"height":1024,"orientation":"PORTRAIT","aspect_ratio":"3:4","spatial_transform":"ASPECT_FIT_LETTERBOX","temporal_transform":"PHONE_TEST_DURATION_WINDOWS_V01","canonical_frame_offsets_ms":[1500,4500,7500],"evidence_profile_version":"PHONE_TEST_DURATION_WINDOWS_V01"},"assets":[{"asset_id":"asset_3ae655d4-2d3c-5a27-a968-075348ba07fa","media_kind":"PHOTO","media_source":"PHONE_LIBRARY_DAY_TEST","original_file_extension":"jpg","original_sha256":"0000000000000000000000000000000000000000000000000000000000000065","original_bytes":10000,"original_width":1920,"original_height":1080,"original_duration_ms":null,"original_included":false,"logical_asset_duration_ms":9000,"materialized_video":false,"evidence_sampling_profile":"PHOTO_SINGLE_FRAME","evidence_window_count":1,"frames":[{"frame_id":"frame_3ae655d4-2d3c-5a27-a968-075348ba07fa_00","window_index":0,"window_count":1,"sample_role":"PHOTO_REPRESENTATIVE","canonical_offset_ms":4500,"source_timestamp_ms":null,"relative_path":"frames/frame_3ae655d4-2d3c-5a27-a968-075348ba07fa_00.jpg","sha256":"463321c93080fe173220f2752cfc1dae1d11e3a8e48fc3a93d667e3431909f80","width":768,"height":1024,"spatial_transform":"ASPECT_FIT_LETTERBOX"}],"sequence_index":0}]}