{"bundle_version":"DIARY_ONE_APP_LIBRARY_BUNDLE_V04","research_only":true,"session":{"session_id":"975c8204-ba21-4557-958e-7cf99b700434","exported_at":"2026-10-19T10:01:50.136264+00:00","timezone":"TEST_DAY_NO_TIMEZONE"},"device":{"device_id":"PHOTO_LIBRARY_TEST","hardware_revision":"N/A","firmware_version":"N/A","sdk_version":"diary-one-app-expo"},"normalization":{"width":768,"height":1024,"orientation":"PORTRAIT","aspect_ratio":"3:4","spatial_transform":"ASPECT_FIT_LETTERBOX","temporal_transform":"PHONE_TEST_DURATION_WINDOWS_V01","canonical_frame_offsets_ms":[1500,4500,7500],"evidence_profile_version":"PHONE_TEST_DURATION_WINDOWS_V01"},"assets":[{"asset_id":"asset-0","source_display_name":"tokyo_zoo_t001440_10s.mp4","media_kind":"VIDEO","media_source":"PHONE_LIBRARY_DAY_TEST","original_file_extension":"mp4","original_sha256":"a250ad06b6a5004e07e6bbf9e62f2776cc98bd159006862088cd8cd8564b754b","original_bytes":7819663,"original_width":2560,"original_height":1440,"original_duration_ms":10000,"original_included":false,"sequence_index":0,"logical_asset_duration_ms":9000,"materialized_video":false,"evidence_sampling_profile":"OFFLINE_MOBILECLIP_S0_FP16_V07_REPLAY","evidence_window_count":1,"frames":[{"frame_id":"asset-0-f0","window_index":0,"window_count":1,"sample_role":"WINDOW_MIDDLE","canonical_offset_ms":4500,"source_timestamp_ms":3000,"spatial_transform":"ASPECT_FIT_LETTERBOX","relative_path":"frames/asset-0-f0.jpg","sha256":"e0d1f0a69436dba8d7b83d67d477bec48984f853e740047c30f972d94efc571b","width":768,"height":1024}]},{"asset_id":"asset-1","source_display_name":"tokyo_zoo_t001680_10s.mp4","media_kind":"VIDEO","media_source":"PHONE_LIBRARY_DAY_TEST","original_file_extension":"mp4","original_sha256":"ed0331889abf0b525dce327966ff2442d339cf31fb2ca87c6b754206e0654102","original_bytes":7801847,"original_width":2560,"original_height":1440,"original_duration_ms":10000,"original_included":false,"sequence_index":1,"logical_asset_duration_ms":9000,"materialized_video":false,"evidence_sampling_profile":"OFFLINE_MOBILECLIP_S0_FP16_V07_REPLAY","evidence_window_count":1,"frames":[{"frame_id":"asset-1-f0","window_index":0,"window_count":1,"sample_role":"WINDOW_EARLY","canonical_offset_ms":1500,"source_timestamp_ms":1000,"spatial_transform":"ASPECT_FIT_LETTERBOX","relative_path":"frames/asset-1-f0.jpg","sha256":"0d82eab46f3a65345bdf68f2de69d1060db363ffc560aff92168dfabe4a8bcbe","width":768,"height":1024},{"frame_id":"asset-1-f1","window_index":0,"window_count":1,"sample_role":"WINDOW_MIDDLE","canonical_offset_ms":4500,"source_timestamp_ms":2000,"spatial_transform":"ASPECT_FIT_LETTERBOX","relative_path":"frames/asset-1-f1.jpg","sha256":"11aee31c20ba7e0205e58f5671bd4f92fa2022bd00183fd5c76006fc70bce1f9","width":768,"height":1024},{"frame_id":"asset-1-f2","window_index":0,"window_count":1,"sample_role":"WINDOW_LATE","canonical_offset_ms":7500,"source_timestamp_ms":7000,"spatial_transform":"ASPECT_FIT_LETTERBOX","relative_path":"frames/asset-1-f2.jpg","sha256":"37b574e9f1c292a070472d788fd01bcafb4366996046d266844030c5e6ca7735","width":768,"height":1024}]},{"asset_id":"asset-2","source_display_name":"tokyo_zoo_t001920_10s.mp4","media_kind":"VIDEO","media_source":"PHONE_LIBRARY_DAY_TEST","original_file_extension":"mp4","original_sha256":"0c078403271823df57d5c9fca55415a72fac9a37af4d3892fd010e3567eee548","original_bytes":7865681,"original_width":2560,"original_height":1440,"original_duration_ms":10000,"original_included":false,"sequence_index":2,"logical_asset_duration_ms":9000,"materialized_video":false,"evidence_sampling_profile":"OFFLINE_MOBILECLIP_S0_FP16_V07_REPLAY","evidence_window_count":1,"frames":[{"frame_id":"asset-2-f0","window_index":0,"window_count":1,"sample_role":"WINDOW_MIDDLE","canonical_offset_ms":4500,"source_timestamp_ms":5000,"spatial_transform":"ASPECT_FIT_LETTERBOX","relative_path":"frames/asset-2-f0.jpg","sha256":"baff6bcb1132c23d3d9ab15f4ef8ccf4558a74d605550f797e3997ffca74bc5f","width":768,"height":1024}]},{"asset_id":"asset-3","source_display_name":"tokyo_zoo_t002160_10s.mp4","media_kind":"VIDEO","media_source":"PHONE_LIBRARY_DAY_TEST","original_file_extension":"mp4","original_sha256":"1bf55973f1c9fbbda51b6ae0bcb96faff45ab89b80125c9e67893dc18fed2731","original_bytes":7808965,"original_width":2560,"original_height":1440,"original_duration_ms":10000,"original_included":false,"sequence_index":3,"logical_asset_duration_ms":9000,"materialized_video":false,"evidence_sampling_profile":"OFFLINE_MOBILECLIP_S0_FP16_V07_REPLAY","evidence_window_count":1,"frames":[{"frame_id":"asset-3-f0","window_index":0,"window_count":1,"sample_role":"WINDOW_EARLY","canonical_offset_ms":1500,"source_timestamp_ms":2000,"spatial_transform":"ASPECT_FIT_LETTERBOX","relative_path":"frames/asset-3-f0.jpg","sha256":"da1b8d1920c48bf68e29769f5c312c4efe49af1751e53b856a5df2d8c5105836","width":768,"height":1024},{"frame_id":"asset-3-f1","window_index":0,"window_count":1,"sample_role":"WINDOW_LATE","canonical_offset_ms":7500,"source_timestamp_ms":8000,"spatial_transform":"ASPECT_FIT_LETTERBOX","relative_path":"frames/asset-3-f1.jpg","sha256":"4e6b3059cf975a008c10b8252e7b82dbaab0018e9221f21bd08980984b70925e","width":768,"height":1024}]},{"asset_id":"asset-4","source_display_name":"tokyo_zoo_t002400_10s.mp4","media_kind":"VIDEO","media_source":"PHONE_LIBRARY_DAY_TEST","original_file_extension":"mp4","original_sha256":"3a7d15aaa3feec83ef9d9de3f2257052a2cf723628d226cba8a9543cb7418799","original_bytes":7846317,"original_width":2560,"original_height":1440,"original_duration_ms":10000,"original_included":false,"sequence_index":4,"logical_asset_duration_ms":9000,"materialized_video":false,"evidence_sampling_profile":"OFFLINE_MOBILECLIP_S0_FP16_V07_REPLAY","evidence_window_count":1,"frames":[{"frame_id":"asset-4-f0","window_index":0,"window_count":1,"sample_role":"WINDOW_MIDDLE","canonical_offset_ms":4500,"source_timestamp_ms":4000,"spatial_transform":"ASPECT_FIT_LETTERBOX","relative_path":"frames/asset-4-f0.jpg","sha256":"e0485987c01a944eb085233affa46e33e9aeebf8691fda3c2197b7c650d5d9b7","width":768,"height":1024}]},{"asset_id":"asset-5","source_display_name":"tokyo_zoo_t002640_10s.mp4","media_kind":"VIDEO","media_source":"PHONE_LIBRARY_DAY_TEST","original_file_extension":"mp4","original_sha256":"6d4fbd5fc0f2aaf77887bf2a12ab46adecb304e7fcd611b86f0af5fd1798ed78","original_bytes":7810104,"original_width":2560,"original_height":1440,"original_duration_ms":10000,"original_included":false,"sequence_index":5,"logical_asset_duration_ms":9000,"materialized_video":false,"evidence_sampling_profile":"OFFLINE_MOBILECLIP_S0_FP16_V07_REPLAY","evidence_window_count":1,"frames":[{"frame_id":"asset-5-f0","window_index":0,"window_count":1,"sample_role":"WINDOW_MIDDLE","canonical_offset_ms":4500,"source_timestamp_ms":4000,"spatial_transform":"ASPECT_FIT_LETTERBOX","relative_path":"frames/asset-5-f0.jpg","sha256":"af14fdf5365d562d94ea699aa501dde3b36142627d961ea28b6a45e53b5d74af","width":768,"height":1024}]},{"asset_id":"asset-6","source_display_name":"tokyo_zoo_t002880_10s.mp4","media_kind":"VIDEO","media_source":"PHONE_LIBRARY_DAY_TEST","original_file_extension":"mp4","original_sha256":"54cb29305cb164cb3cc63713a2e5f6de530b8ae3ec265414490d718f7be2b3b2","original_bytes":7825139,"original_width":2560,"original_height":1440,"original_duration_ms":10000,"original_included":false,"sequence_index":6,"logical_asset_duration_ms":9000,"materialized_video":false,"evidence_sampling_profile":"OFFLINE_MOBILECLIP_S0_FP16_V07_REPLAY","evidence_window_count":1,"frames":[{"frame_id":"asset-6-f0","window_index":0,"window_count":1,"sample_role":"WINDOW_EARLY","canonical_offset_ms":1500,"source_timestamp_ms":1000,"spatial_transform":"ASPECT_FIT_LETTERBOX","relative_path":"frames/asset-6-f0.jpg","sha256":"8cfe263e143bc2ed0a4efc69f7f0be4b8a4a60ebf6b1dc1180baa215831e1b0e","width":768,"height":1024},{"frame_id":"asset-6-f1","window_index":0,"window_count":1,"sample_role":"WINDOW_MIDDLE","canonical_offset_ms":4500,"source_timestamp_ms":4000,"spatial_transform":"ASPECT_FIT_LETTERBOX","relative_path":"frames/asset-6-f1.jpg","sha256":"5589b25383319a31d964977a2c6e0bb7362e0d217c9114acf98206fcc2917dcc","width":768,"height":1024},{"frame_id":"asset-6-f2","window_index":0,"window_count":1,"sample_role":"WINDOW_LATE","canonical_offset_ms":7500,"source_timestamp_ms":9000,"spatial_transform":"ASPECT_FIT_LETTERBOX","relative_path":"frames/asset-6-f2.jpg","sha256":"25994ff47c18a81b430dd072a5697467954cafc65e62f2c65c258aee57751da5","width":768,"height":1024}]},{"asset_id":"asset-7","source_display_name":"tokyo_zoo_t003360_10s.mp4","media_kind":"VIDEO","media_source":"PHONE_LIBRARY_DAY_TEST","original_file_extension":"mp4","original_sha256":"6b428172dbc509343b4fc0f45cc44ae6c2fb8413d66b16c9df2b476de983ce72","original_bytes":7846909,"original_width":2560,"original_height":1440,"original_duration_ms":10000,"original_included":false,"sequence_index":7,"logical_asset_duration_ms":9000,"materialized_video":false,"evidence_sampling_profile":"OFFLINE_MOBILECLIP_S0_FP16_V07_REPLAY","evidence_window_count":1,"frames":[{"frame_id":"asset-7-f0","window_index":0,"window_count":1,"sample_role":"WINDOW_EARLY","canonical_offset_ms":1500,"source_timestamp_ms":1000,"spatial_transform":"ASPECT_FIT_LETTERBOX","relative_path":"frames/asset-7-f0.jpg","sha256":"7323f3616921b72ee4a9c98b8b0c866815d6f6719035f3c6ec526194eea8a90e","width":768,"height":1024},{"frame_id":"asset-7-f1","window_index":0,"window_count":1,"sample_role":"WINDOW_LATE","canonical_offset_ms":7500,"source_timestamp_ms":5000,"spatial_transform":"ASPECT_FIT_LETTERBOX","relative_path":"frames/asset-7-f1.jpg","sha256":"5c988f249264c13866088d37a0dabde863c1bc3b8c39f09db8bcf8e372c305af","width":768,"height":1024}]}]}