{"bundle_version":"DIARY_ONE_APP_LIBRARY_BUNDLE_V04","research_only":true,"session":{"session_id":"d18555e5-f9c9-4931-ab8e-cdcc9aab6246","exported_at":"2026-10-19T10:01:50.136264+00:00","timezone":"TEST_DAY_NO_TIMEZONE"},"device":{"device_id":"PHOTO_LIBRARY_TEST","hardware_revision":"N/A","firmware_version":"N/A","sdk_version":"diary-one-app-expo"},"normalization":{"width":768,"height":1024,"orientation":"PORTRAIT","aspect_ratio":"3:4","spatial_transform":"ASPECT_FIT_LETTERBOX","temporal_transform":"PHONE_TEST_DURATION_WINDOWS_V01","canonical_frame_offsets_ms":[1500,4500,7500],"evidence_profile_version":"PHONE_TEST_DURATION_WINDOWS_V01"},"assets":[{"asset_id":"asset-0","source_display_name":"nagoya_cycling_t000000_10s.mp4","media_kind":"VIDEO","media_source":"PHONE_LIBRARY_DAY_TEST","original_file_extension":"mp4","original_sha256":"35c0bce3e8727dbb0ed555fc80c821211ef791a3d612220e9ce3687e55b0f665","original_bytes":7899859,"original_width":2560,"original_height":1440,"original_duration_ms":10010,"original_included":false,"sequence_index":0,"logical_asset_duration_ms":9000,"materialized_video":false,"evidence_sampling_profile":"OFFLINE_MOBILECLIP_S0_FP16_V07_REPLAY","evidence_window_count":1,"frames":[{"frame_id":"asset-0-f0","window_index":0,"window_count":1,"sample_role":"WINDOW_EARLY","canonical_offset_ms":1500,"source_timestamp_ms":1001,"spatial_transform":"ASPECT_FIT_LETTERBOX","relative_path":"frames/asset-0-f0.jpg","sha256":"801d87d99aa5c4c852e6204594f7c7b6cc0af252456f62deeeb93591ef55bd3e","width":768,"height":1024},{"frame_id":"asset-0-f1","window_index":0,"window_count":1,"sample_role":"WINDOW_LATE","canonical_offset_ms":7500,"source_timestamp_ms":5005,"spatial_transform":"ASPECT_FIT_LETTERBOX","relative_path":"frames/asset-0-f1.jpg","sha256":"88972962975953a12b0c5e78870fd64a55c433a145fc37ae1db6621787ddcfb5","width":768,"height":1024}]},{"asset_id":"asset-1","source_display_name":"nagoya_cycling_t000240_10s.mp4","media_kind":"VIDEO","media_source":"PHONE_LIBRARY_DAY_TEST","original_file_extension":"mp4","original_sha256":"73eaa6ea0c2dfcacc660fb0aeb44ff11c62e1e78c4b3229a50b38b63f729a12b","original_bytes":7877367,"original_width":2560,"original_height":1440,"original_duration_ms":10010,"original_included":false,"sequence_index":1,"logical_asset_duration_ms":9000,"materialized_video":false,"evidence_sampling_profile":"OFFLINE_MOBILECLIP_S0_FP16_V07_REPLAY","evidence_window_count":1,"frames":[{"frame_id":"asset-1-f0","window_index":0,"window_count":1,"sample_role":"WINDOW_MIDDLE","canonical_offset_ms":4500,"source_timestamp_ms":6006,"spatial_transform":"ASPECT_FIT_LETTERBOX","relative_path":"frames/asset-1-f0.jpg","sha256":"7e5d8fb03c2d6bd431c9fe565db3f8c4dec0e23838e6b6841eaaa928e1aaaba3","width":768,"height":1024}]},{"asset_id":"asset-2","source_display_name":"nagoya_cycling_t000480_10s.mp4","media_kind":"VIDEO","media_source":"PHONE_LIBRARY_DAY_TEST","original_file_extension":"mp4","original_sha256":"0ccaa27b011ab97ea25f19c16fe1df6f509bf34b9167a36c159b1f6c3386a6e5","original_bytes":7886435,"original_width":2560,"original_height":1440,"original_duration_ms":9993,"original_included":false,"sequence_index":2,"logical_asset_duration_ms":9000,"materialized_video":false,"evidence_sampling_profile":"OFFLINE_MOBILECLIP_S0_FP16_V07_REPLAY","evidence_window_count":1,"frames":[{"frame_id":"asset-2-f0","window_index":0,"window_count":1,"sample_role":"WINDOW_MIDDLE","canonical_offset_ms":4500,"source_timestamp_ms":6005,"spatial_transform":"ASPECT_FIT_LETTERBOX","relative_path":"frames/asset-2-f0.jpg","sha256":"c9e5601397b662068df4e7db85c1f1e20a4d1e28e205e4cbffa3c8f8de125f48","width":768,"height":1024}]},{"asset_id":"asset-3","source_display_name":"nagoya_cycling_t000720_10s.mp4","media_kind":"VIDEO","media_source":"PHONE_LIBRARY_DAY_TEST","original_file_extension":"mp4","original_sha256":"40f300d0ad77b766f60bbc677472a60aa88d5a417c38d984d6228f988a9c98f4","original_bytes":7896835,"original_width":2560,"original_height":1440,"original_duration_ms":10010,"original_included":false,"sequence_index":3,"logical_asset_duration_ms":9000,"materialized_video":false,"evidence_sampling_profile":"OFFLINE_MOBILECLIP_S0_FP16_V07_REPLAY","evidence_window_count":1,"frames":[{"frame_id":"asset-3-f0","window_index":0,"window_count":1,"sample_role":"WINDOW_MIDDLE","canonical_offset_ms":4500,"source_timestamp_ms":5005,"spatial_transform":"ASPECT_FIT_LETTERBOX","relative_path":"frames/asset-3-f0.jpg","sha256":"958eb2f9b92e66d61a4109a4fb29b7761d5e37faf0a602260bdf5a78764710ac","width":768,"height":1024}]},{"asset_id":"asset-4","source_display_name":"nagoya_cycling_t000960_10s.mp4","media_kind":"VIDEO","media_source":"PHONE_LIBRARY_DAY_TEST","original_file_extension":"mp4","original_sha256":"7c6429608b87001e0ae3add0f97eb6f2d67b60d1bc866c3947d5399f2fb33ecc","original_bytes":7872704,"original_width":2560,"original_height":1440,"original_duration_ms":9993,"original_included":false,"sequence_index":4,"logical_asset_duration_ms":9000,"materialized_video":false,"evidence_sampling_profile":"OFFLINE_MOBILECLIP_S0_FP16_V07_REPLAY","evidence_window_count":1,"frames":[{"frame_id":"asset-4-f0","window_index":0,"window_count":1,"sample_role":"WINDOW_EARLY","canonical_offset_ms":1500,"source_timestamp_ms":3002,"spatial_transform":"ASPECT_FIT_LETTERBOX","relative_path":"frames/asset-4-f0.jpg","sha256":"673bf4e087790aa02e54d7f7ce3660c05b2e4c4a034f234b962534150a122048","width":768,"height":1024},{"frame_id":"asset-4-f1","window_index":0,"window_count":1,"sample_role":"WINDOW_MIDDLE","canonical_offset_ms":4500,"source_timestamp_ms":6005,"spatial_transform":"ASPECT_FIT_LETTERBOX","relative_path":"frames/asset-4-f1.jpg","sha256":"900c5988817994f536f0c9edcc3829338c58aedb5d3087d50e040714bb61652f","width":768,"height":1024},{"frame_id":"asset-4-f2","window_index":0,"window_count":1,"sample_role":"WINDOW_LATE","canonical_offset_ms":7500,"source_timestamp_ms":8992,"spatial_transform":"ASPECT_FIT_LETTERBOX","relative_path":"frames/asset-4-f2.jpg","sha256":"cafc6d482fb4e65306a079881c37d88a27828b520304d278dd34313a97adc834","width":768,"height":1024}]},{"asset_id":"asset-5","source_display_name":"nagoya_cycling_t001200_10s.mp4","media_kind":"VIDEO","media_source":"PHONE_LIBRARY_DAY_TEST","original_file_extension":"mp4","original_sha256":"c6e0e7bdef8d1431c1fa2e4e47105b866e85c1c4461b4f8f2ac2f121dba8ad4f","original_bytes":7885200,"original_width":2560,"original_height":1440,"original_duration_ms":9993,"original_included":false,"sequence_index":5,"logical_asset_duration_ms":9000,"materialized_video":false,"evidence_sampling_profile":"OFFLINE_MOBILECLIP_S0_FP16_V07_REPLAY","evidence_window_count":1,"frames":[{"frame_id":"asset-5-f0","window_index":0,"window_count":1,"sample_role":"WINDOW_MIDDLE","canonical_offset_ms":4500,"source_timestamp_ms":6005,"spatial_transform":"ASPECT_FIT_LETTERBOX","relative_path":"frames/asset-5-f0.jpg","sha256":"af34633a5b8b666eef2ecde43815fa2e61ebddff5d367f89040c27d587ab37ac","width":768,"height":1024}]},{"asset_id":"asset-6","source_display_name":"nagoya_cycling_t001440_10s.mp4","media_kind":"VIDEO","media_source":"PHONE_LIBRARY_DAY_TEST","original_file_extension":"mp4","original_sha256":"9f18811437a32a0806208da704cbe7c4dbfb47a456c0766f3c498fc0f79a0eec","original_bytes":7899250,"original_width":2560,"original_height":1440,"original_duration_ms":10010,"original_included":false,"sequence_index":6,"logical_asset_duration_ms":9000,"materialized_video":false,"evidence_sampling_profile":"OFFLINE_MOBILECLIP_S0_FP16_V07_REPLAY","evidence_window_count":1,"frames":[{"frame_id":"asset-6-f0","window_index":0,"window_count":1,"sample_role":"WINDOW_MIDDLE","canonical_offset_ms":4500,"source_timestamp_ms":5005,"spatial_transform":"ASPECT_FIT_LETTERBOX","relative_path":"frames/asset-6-f0.jpg","sha256":"1b4beba548bda7cf483c20e6afb01b67094613835cab8a77af178a0f441dd2a0","width":768,"height":1024}]},{"asset_id":"asset-7","source_display_name":"nagoya_cycling_t001680_10s.mp4","media_kind":"VIDEO","media_source":"PHONE_LIBRARY_DAY_TEST","original_file_extension":"mp4","original_sha256":"42f619497f6c24b9f92ad34d37007a7a5add512c597666a8c9c3bb75f0cc0fab","original_bytes":7899703,"original_width":2560,"original_height":1440,"original_duration_ms":9993,"original_included":false,"sequence_index":7,"logical_asset_duration_ms":9000,"materialized_video":false,"evidence_sampling_profile":"OFFLINE_MOBILECLIP_S0_FP16_V07_REPLAY","evidence_window_count":1,"frames":[{"frame_id":"asset-7-f0","window_index":0,"window_count":1,"sample_role":"WINDOW_EARLY","canonical_offset_ms":1500,"source_timestamp_ms":16,"spatial_transform":"ASPECT_FIT_LETTERBOX","relative_path":"frames/asset-7-f0.jpg","sha256":"fe497baa415c0c1779312d1347547be4db66bc8ab894e4afc396fcd8d12ddf32","width":768,"height":1024},{"frame_id":"asset-7-f1","window_index":0,"window_count":1,"sample_role":"WINDOW_MIDDLE","canonical_offset_ms":4500,"source_timestamp_ms":5004,"spatial_transform":"ASPECT_FIT_LETTERBOX","relative_path":"frames/asset-7-f1.jpg","sha256":"356935cb4c7e4f035f6e705de85e2c9295108f4cf611aff2f5312735abcb2535","width":768,"height":1024},{"frame_id":"asset-7-f2","window_index":0,"window_count":1,"sample_role":"WINDOW_LATE","canonical_offset_ms":7500,"source_timestamp_ms":8992,"spatial_transform":"ASPECT_FIT_LETTERBOX","relative_path":"frames/asset-7-f2.jpg","sha256":"f0a02dd417f8e286d4aa14305dd5732aa54c9a7c01bf337203559b16fa3aaaa1","width":768,"height":1024}]}]}