{"bundle_version":"DIARY_ONE_APP_LIBRARY_BUNDLE_V04","research_only":true,"session":{"session_id":"539574d6-c072-44e8-a120-caf17ebd563e","exported_at":"2026-10-19T10:33:17.603425+00:00","timezone":"TEST_DAY_NO_TIMEZONE"},"device":{"device_id":"PHOTO_LIBRARY_TEST","hardware_revision":"N/A","firmware_version":"N/A","sdk_version":"diary-one-app-expo"},"normalization":{"width":768,"height":1024,"orientation":"PORTRAIT","aspect_ratio":"3:4","spatial_transform":"ASPECT_FIT_LETTERBOX","temporal_transform":"PHONE_TEST_DURATION_WINDOWS_V01","canonical_frame_offsets_ms":[1500,4500,7500],"evidence_profile_version":"PHONE_TEST_DURATION_WINDOWS_V01"},"assets":[{"asset_id":"asset-0","source_display_name":"rural_cycling_t000240_10s.mp4","media_kind":"VIDEO","media_source":"PHONE_LIBRARY_DAY_TEST","original_file_extension":"mp4","original_sha256":"a6df49cb6be9af9cca7cabfa508733ff0c4afee15b5c5940b3d2c128a93e6721","original_bytes":8727802,"original_width":2560,"original_height":1440,"original_duration_ms":10000,"original_included":false,"sequence_index":0,"logical_asset_duration_ms":9000,"materialized_video":false,"evidence_sampling_profile":"OFFLINE_MOBILECLIP_S0_FP16_V07_REPLAY","evidence_window_count":1,"frames":[{"frame_id":"asset-0-f0","window_index":0,"window_count":1,"sample_role":"WINDOW_MIDDLE","canonical_offset_ms":4500,"source_timestamp_ms":4000,"spatial_transform":"ASPECT_FIT_LETTERBOX","relative_path":"frames/asset-0-f0.jpg","sha256":"17593cd3b6e98608c6baa33fa2fd9d4b698bf717c996edb071510550a5082cd9","width":768,"height":1024}]},{"asset_id":"asset-1","source_display_name":"rural_cycling_t000480_10s.mp4","media_kind":"VIDEO","media_source":"PHONE_LIBRARY_DAY_TEST","original_file_extension":"mp4","original_sha256":"06fc721ee6a8cb8d55dc761c8d651186730e4809830e0da427496eabca3dcd96","original_bytes":8726297,"original_width":2560,"original_height":1440,"original_duration_ms":10000,"original_included":false,"sequence_index":1,"logical_asset_duration_ms":9000,"materialized_video":false,"evidence_sampling_profile":"OFFLINE_MOBILECLIP_S0_FP16_V07_REPLAY","evidence_window_count":1,"frames":[{"frame_id":"asset-1-f0","window_index":0,"window_count":1,"sample_role":"WINDOW_EARLY","canonical_offset_ms":1500,"source_timestamp_ms":0,"spatial_transform":"ASPECT_FIT_LETTERBOX","relative_path":"frames/asset-1-f0.jpg","sha256":"1d2fd7c49e6a6cae70554ce984b606a6322989b1c7854288be5fc6d813b67d11","width":768,"height":1024},{"frame_id":"asset-1-f1","window_index":0,"window_count":1,"sample_role":"WINDOW_MIDDLE","canonical_offset_ms":4500,"source_timestamp_ms":3000,"spatial_transform":"ASPECT_FIT_LETTERBOX","relative_path":"frames/asset-1-f1.jpg","sha256":"b81768705a85e67517e3ec864c92a9fefc7d3597aca7975543e5d8094909fb17","width":768,"height":1024},{"frame_id":"asset-1-f2","window_index":0,"window_count":1,"sample_role":"WINDOW_LATE","canonical_offset_ms":7500,"source_timestamp_ms":5000,"spatial_transform":"ASPECT_FIT_LETTERBOX","relative_path":"frames/asset-1-f2.jpg","sha256":"b074304fbc3feec67753adb0224b14b5b6e9e6d1eac596bafee7ff055c148a96","width":768,"height":1024}]},{"asset_id":"asset-2","source_display_name":"rural_cycling_t000960_10s.mp4","media_kind":"VIDEO","media_source":"PHONE_LIBRARY_DAY_TEST","original_file_extension":"mp4","original_sha256":"fe737487b19d8aaca906f3748c1a800b1fbd80b6e5dd8de7f1b862c3abda40ed","original_bytes":8736969,"original_width":2560,"original_height":1440,"original_duration_ms":10000,"original_included":false,"sequence_index":2,"logical_asset_duration_ms":9000,"materialized_video":false,"evidence_sampling_profile":"OFFLINE_MOBILECLIP_S0_FP16_V07_REPLAY","evidence_window_count":1,"frames":[{"frame_id":"asset-2-f0","window_index":0,"window_count":1,"sample_role":"WINDOW_MIDDLE","canonical_offset_ms":4500,"source_timestamp_ms":5000,"spatial_transform":"ASPECT_FIT_LETTERBOX","relative_path":"frames/asset-2-f0.jpg","sha256":"0d6a86b978c7661a46385746a2f084c23c546791cf93133207b749fb24e32160","width":768,"height":1024}]},{"asset_id":"asset-3","source_display_name":"rural_cycling_t001200_10s.mp4","media_kind":"VIDEO","media_source":"PHONE_LIBRARY_DAY_TEST","original_file_extension":"mp4","original_sha256":"82a519e5b4a650bc19c82d2b8a1ee6cd6b1e114dab825dc9dd87f111512d1ad2","original_bytes":8725874,"original_width":2560,"original_height":1440,"original_duration_ms":10000,"original_included":false,"sequence_index":3,"logical_asset_duration_ms":9000,"materialized_video":false,"evidence_sampling_profile":"OFFLINE_MOBILECLIP_S0_FP16_V07_REPLAY","evidence_window_count":1,"frames":[{"frame_id":"asset-3-f0","window_index":0,"window_count":1,"sample_role":"WINDOW_MIDDLE","canonical_offset_ms":4500,"source_timestamp_ms":8000,"spatial_transform":"ASPECT_FIT_LETTERBOX","relative_path":"frames/asset-3-f0.jpg","sha256":"851782242eaaba6dbf413fffba36b06094884a7fad6a1a980f025bc93df47342","width":768,"height":1024}]},{"asset_id":"asset-4","source_display_name":"rural_cycling_t001440_10s.mp4","media_kind":"VIDEO","media_source":"PHONE_LIBRARY_DAY_TEST","original_file_extension":"mp4","original_sha256":"a45aaaf6e9affe7ae40d3b93766164b975b10e44bcab9ab8336886a5b1cc6806","original_bytes":8725054,"original_width":2560,"original_height":1440,"original_duration_ms":10000,"original_included":false,"sequence_index":4,"logical_asset_duration_ms":9000,"materialized_video":false,"evidence_sampling_profile":"OFFLINE_MOBILECLIP_S0_FP16_V07_REPLAY","evidence_window_count":1,"frames":[{"frame_id":"asset-4-f0","window_index":0,"window_count":1,"sample_role":"WINDOW_MIDDLE","canonical_offset_ms":4500,"source_timestamp_ms":1000,"spatial_transform":"ASPECT_FIT_LETTERBOX","relative_path":"frames/asset-4-f0.jpg","sha256":"c880eb177aef820377e5f06afd17feb97100618776d37e863fdf6c47a7a853e8","width":768,"height":1024}]},{"asset_id":"asset-5","source_display_name":"rural_cycling_t001680_10s.mp4","media_kind":"VIDEO","media_source":"PHONE_LIBRARY_DAY_TEST","original_file_extension":"mp4","original_sha256":"9cef67db8ce99dc3baa651344869675a97facf8d266c087d6533dc8e6b7d384e","original_bytes":8731964,"original_width":2560,"original_height":1440,"original_duration_ms":10000,"original_included":false,"sequence_index":5,"logical_asset_duration_ms":9000,"materialized_video":false,"evidence_sampling_profile":"OFFLINE_MOBILECLIP_S0_FP16_V07_REPLAY","evidence_window_count":1,"frames":[{"frame_id":"asset-5-f0","window_index":0,"window_count":1,"sample_role":"WINDOW_EARLY","canonical_offset_ms":1500,"source_timestamp_ms":1000,"spatial_transform":"ASPECT_FIT_LETTERBOX","relative_path":"frames/asset-5-f0.jpg","sha256":"da337b6cbb0dcbdb98d2ac11419cdb189e680e189b3fe910f2cea3c5ee3a38c5","width":768,"height":1024},{"frame_id":"asset-5-f1","window_index":0,"window_count":1,"sample_role":"WINDOW_MIDDLE","canonical_offset_ms":4500,"source_timestamp_ms":5000,"spatial_transform":"ASPECT_FIT_LETTERBOX","relative_path":"frames/asset-5-f1.jpg","sha256":"7cbf7820497ee84601e5c57f7b61398b191b002693367894b5807de728a143b0","width":768,"height":1024},{"frame_id":"asset-5-f2","window_index":0,"window_count":1,"sample_role":"WINDOW_LATE","canonical_offset_ms":7500,"source_timestamp_ms":9000,"spatial_transform":"ASPECT_FIT_LETTERBOX","relative_path":"frames/asset-5-f2.jpg","sha256":"5c89ad78220b602ca5643d22f8623c821a1c58a91265d3534925831e8b0b1c8f","width":768,"height":1024}]},{"asset_id":"asset-6","source_display_name":"rural_cycling_t001920_10s.mp4","media_kind":"VIDEO","media_source":"PHONE_LIBRARY_DAY_TEST","original_file_extension":"mp4","original_sha256":"407c9a59de386c98ba8792ea0c8846ea4d93fa33e0d6cf2bd06895f91abbec5f","original_bytes":8737120,"original_width":2560,"original_height":1440,"original_duration_ms":10000,"original_included":false,"sequence_index":6,"logical_asset_duration_ms":9000,"materialized_video":false,"evidence_sampling_profile":"OFFLINE_MOBILECLIP_S0_FP16_V07_REPLAY","evidence_window_count":1,"frames":[{"frame_id":"asset-6-f0","window_index":0,"window_count":1,"sample_role":"WINDOW_MIDDLE","canonical_offset_ms":4500,"source_timestamp_ms":4000,"spatial_transform":"ASPECT_FIT_LETTERBOX","relative_path":"frames/asset-6-f0.jpg","sha256":"325d4dbbf6a6d56acd9c484c89990f994600d1fe44370ee7a865ab7d0d77d926","width":768,"height":1024}]},{"asset_id":"asset-7","source_display_name":"rural_cycling_t002400_10s.mp4","media_kind":"VIDEO","media_source":"PHONE_LIBRARY_DAY_TEST","original_file_extension":"mp4","original_sha256":"4e7eaf4388c2b42ca5df1635a511dfefd0114d10c241ed15876557d6c4226d26","original_bytes":8742932,"original_width":2560,"original_height":1440,"original_duration_ms":10000,"original_included":false,"sequence_index":7,"logical_asset_duration_ms":9000,"materialized_video":false,"evidence_sampling_profile":"OFFLINE_MOBILECLIP_S0_FP16_V07_REPLAY","evidence_window_count":1,"frames":[{"frame_id":"asset-7-f0","window_index":0,"window_count":1,"sample_role":"WINDOW_MIDDLE","canonical_offset_ms":4500,"source_timestamp_ms":8000,"spatial_transform":"ASPECT_FIT_LETTERBOX","relative_path":"frames/asset-7-f0.jpg","sha256":"bef5e4f69048322a5757ad9bf745ac08aa8c828a2455845936567951cbfffbd9","width":768,"height":1024}]}]}